{
  "$schema": "../schemas/config.schema.json",
  "schemaVersion": 2,
  "server": {
    "host": "127.0.0.1",
    "port": 7861,
    "authentication": "none",
    "allowedOrigins": []
  },
  "audio": {
    "outputDevice": "system-default"
  },
  "modelRegistry": {
    "directories": [
      "./models"
    ],
    "watchForChanges": true,
    "idleUnloadSeconds": 600,
    "maximumLoadedGpuModels": 1
  },
  "profiles": {
    "fast": {
      "model": "kokoro-en-v1",
      "device": "cpu",
      "loadPolicy": "eager"
    }
  },
  "languageDefaults": {
    "en": "fast"
  }
}
